{
  "courseId": "politica-adultos",
  "title": "La Política de Adultos en el Movimiento",
  "subtitle": "Formación de Adultos Voluntarios — Asociación Scouts de Colombia",
  "description": "Curso introductorio sobre la Política Nacional de Adultos en el Movimiento Scout: el adulto que necesitamos, el enfoque por competencias y el ciclo de gestión del adulto. Dirigido a consejeros, dirigentes y voluntarios que asumen roles en sus grupos scouts.",
  "contentVersion": "2026-09-20",
  "icon": "🦸",
  "duration": "1 hora 30 minutos",
  "totalContentModules": 5,
  "modules": [
    {
      "id": 1,
      "title": "Bienvenida al Curso",
      "emoji": "🏠",
      "navLabel": "Inicio",
      "isIntro": true,
      "sections": [
        {
          "type": "info-box",
          "text": "<strong>Bienvenido/a a este espacio de formación.</strong><br>Este curso te ayudará a comprender la Política Nacional de Adultos en el Movimiento, el enfoque por competencias y cómo aplicarlo en tu grupo scout."
        },
        {
          "type": "paragraph",
          "text": "Este curso está construido a partir del <strong>Taller Flor de Lis 2 — Sesión 1</strong>, dictado por consejeros y dirigentes activos de la Regional Valle del Cauca. Cada unidad es corta (entre 5 y 15 minutos) y combina video, lectura y reflexión personal."
        },
        {
          "type": "heading",
          "level": 3,
          "text": "🎯 Objetivos del Curso"
        },
        {
          "type": "list",
          "ordered": false,
          "items": [
            "<strong>Reconocer</strong> el rol del adulto voluntario en el movimiento scout",
            "<strong>Comprender</strong> la Política Nacional de Adultos en el Movimiento y sus principios",
            "<strong>Identificar</strong> qué es una competencia y cuáles son las 7 competencias esenciales del adulto",
            "<strong>Conocer</strong> el ciclo de gestión del adulto (atracción, vinculación, desarrollo, evaluación)",
            "<strong>Definir</strong> tu compromiso personal con el grupo scout"
          ]
        },
        {
          "type": "heading",
          "level": 3,
          "text": "📚 Estructura del Curso"
        },
        {
          "type": "timeline",
          "items": [
            { "title": "Unidad 1 — ¿Por qué somos superhéroes?", "description": "Una mirada simbólica al rol del adulto en el movimiento. Hook emocional con video Avengers." },
            { "title": "Unidad 2 — Marco de la Política", "description": "Origen, propósito y herramientas que ofrece la política." },
            { "title": "Unidad 3 — ¿Qué es una competencia?", "description": "Definición saber + hacer + ser, y las 7 competencias esenciales." },
            { "title": "Unidad 4 — El ciclo de gestión del adulto", "description": "Atracción, vinculación, plan personal, asesoría y evaluación." },
            { "title": "Unidad 5 — Tu compromiso", "description": "Síntesis y construcción de tu compromiso personal." }
          ]
        },
        {
          "type": "info-box",
          "text": "<strong>📝 Cómo avanzar:</strong> al final de cada unidad encontrarás una reflexión personal y un quiz corto. Necesitas aprobar el quiz (mínimo 70%) para avanzar a la siguiente unidad."
        }
      ]
    },
    {
      "id": 2,
      "title": "¿Por qué somos superhéroes?",
      "emoji": "🦸",
      "navLabel": "Superhéroes",
      "sections": [
        {
          "type": "heading",
          "level": 3,
          "text": "🎬 Mira el video introductorio"
        },
        {
          "type": "paragraph",
          "text": "Como adultos voluntarios enfrentamos retos que parecen sobrehumanos: cuidar de los chicos, sostener el grupo, articularnos como equipo. Este video pone esa misión en perspectiva."
        },
        {
          "type": "video",
          "src": "politica-adultos/videos/01_video_avengers.mp4",
          "caption": "Video introductorio — Los héroes más poderosos (4:10)"
        },
        {
          "type": "video",
          "src": "politica-adultos/videos/02_reflexion_y_actividad_dibujo.mp4",
          "caption": "Reflexión y actividad — El consejero ideal (5:02)"
        },
        {
          "type": "heading",
          "level": 3,
          "text": "✏️ Actividad — Dibuja tu consejero ideal"
        },
        {
          "type": "paragraph",
          "text": "Antes de avanzar, toma una hoja y un lápiz. Dibújate a ti mismo/a como un superhéroe del movimiento. Responde: <strong>¿qué cualidades debe tener un consejero o consejera ideal?</strong> Tómate 3 minutos."
        },
        {
          "type": "info-box",
          "text": "<strong>Idea clave:</strong> los adultos del movimiento no llegamos perfectos. Llegamos con superpoderes diferentes — competencias adquiridas en la vida — que se complementan en el equipo. La fuerza está en la unión, no en el individuo."
        },
        {
          "type": "heading",
          "level": 3,
          "text": "🎙️ Voces de la comunidad (opcional)"
        },
        {
          "type": "paragraph",
          "text": "Estos videos recogen testimonios de consejeros y consejeras activas compartiendo cómo entienden el rol. No son obligatorios para el quiz, pero enriquecen la perspectiva."
        },
        {
          "type": "video",
          "src": "politica-adultos/videos/03_voces_dibujos_parte1.mp4",
          "caption": "Voces parte 1 — Eliana, Marta y Lina"
        },
        {
          "type": "video",
          "src": "politica-adultos/videos/04_voces_dibujos_parte2.mp4",
          "caption": "Voces parte 2 — Stefanie, Blanca y Amparo"
        }
      ],
      "reflection": {
        "prompt": "¿Qué superpoder reconoces en ti que aporta valor a tu grupo scout? ¿Qué superpoder te falta desarrollar?"
      },
      "quiz": {
        "title": "Evaluación — El adulto que necesitamos",
        "questions": [
          {
            "text": "Según la idea presentada en el video, ¿de dónde proviene la fuerza de los adultos en un grupo scout?",
            "options": [
              "De que cada uno resuelva sus problemas en solitario",
              "De la complementariedad de sus competencias trabajando como equipo",
              "De que el jefe de grupo tenga todas las habilidades necesarias"
            ],
            "correctIndex": 1
          },
          {
            "text": "¿Cuál de estas afirmaciones se acerca más al concepto de adulto que propone el movimiento?",
            "options": [
              "Un adulto perfecto que domina todas las áreas desde su llegada",
              "Una persona en formación continua que aporta sus competencias y desarrolla otras nuevas",
              "Una persona experta que enseña a los chicos sin involucrarse emocionalmente con ellos"
            ],
            "correctIndex": 1
          },
          {
            "text": "La actividad del 'consejero ideal' busca principalmente:",
            "options": [
              "Evaluar tus habilidades de dibujo y tu capacidad de resumir ideas en imágenes",
              "Que articules con tus propias palabras qué valoras en un consejero",
              "Comparar tu visión con la de los otros participantes del curso"
            ],
            "correctIndex": 1
          }
        ],
        "nextLabel": "Continuar a Marco de la Política 📜"
      }
    },
    {
      "id": 3,
      "title": "Marco de la Política de Adultos",
      "emoji": "📜",
      "navLabel": "Marco",
      "sections": [
        {
          "type": "heading",
          "level": 3,
          "text": "🎬 Origen y propósito de la política"
        },
        {
          "type": "video",
          "src": "politica-adultos/videos/05_politica_marco_general.mp4",
          "caption": "Marco general de la Política Nacional de Adultos (4:17)"
        },
        {
          "type": "info-box",
          "text": "<strong>📅 ¿De dónde viene esta política?</strong><br>Se origina en la Conferencia Scout Interamericana y se lanza en Colombia hacia <strong>2017</strong>. Es el marco filosófico, conceptual, pedagógico, estructural y administrativo del Sistema de Gestión de Adultos."
        },
        {
          "type": "heading",
          "level": 3,
          "text": "🔑 Cambio fundamental en el lenguaje"
        },
        {
          "type": "paragraph",
          "text": "Ya no hablamos de <em>jefes</em> y <em>consejeros</em> como categorías separadas. Hablamos de <strong>adultos del movimiento</strong>, lo que incluye también a los rovers que ejercen roles. Todos somos adultos voluntarios con el mismo nivel de responsabilidad y de derechos para nuestro desarrollo personal."
        },
        {
          "type": "heading",
          "level": 3,
          "text": "🎬 Concepto de competencias y principios"
        },
        {
          "type": "video",
          "src": "politica-adultos/videos/06_competencias_y_principios.mp4",
          "caption": "Concepto de competencias y principios de la política (4:10)"
        },
        {
          "type": "method-grid",
          "items": [
            { "title": "Enfoque por competencias", "description": "Reconoce que cada adulto trae conocimientos y habilidades; el grupo se nutre de su complementariedad.", "color": "#fff3e0", "borderColor": "#ff9800" },
            { "title": "Coherencia", "description": "Lo que decimos como adultos debe alinearse con lo que hacemos: somos ejemplo para los chicos.", "color": "#e3f2fd", "borderColor": "#2196f3" },
            { "title": "Organización", "description": "Existen procesos claros (vinculación, evaluación, desarrollo) que evitan decisiones arbitrarias.", "color": "#f3e5f5", "borderColor": "#9c27b0" },
            { "title": "Flexibilidad", "description": "La política se adapta al contexto y necesidades de cada grupo. No es rígida.", "color": "#e8f5e9", "borderColor": "#4caf50" }
          ]
        },
        {
          "type": "heading",
          "level": 3,